{
  "schemaVersion": "0.1.0",
  "jointSet": "mediapipe_pose_hands_v1",
  "coordinateSpace": "normalized",
  "fps": 30,
  "meta": {
    "note": "Example payload for Stage 0"
  },
  "frames": [
    {
      "t": 0.0,
      "overallConfidence": 0.92,
      "joints": {
        "POSE_NOSE": {
          "x": 0.5,
          "y": 0.12,
          "z": -0.1,
          "confidence": 0.95
        },
        "POSE_LEFT_WRIST": {
          "x": 0.35,
          "y": 0.55,
          "z": -0.05,
          "confidence": 0.9
        },
        "POSE_RIGHT_WRIST": {
          "x": 0.65,
          "y": 0.54,
          "z": -0.05,
          "confidence": 0.91
        }
      }
    },
    {
      "t": 0.033,
      "overallConfidence": 0.93,
      "joints": {
        "POSE_NOSE": {
          "x": 0.5,
          "y": 0.12,
          "z": -0.1,
          "confidence": 0.96
        },
        "POSE_LEFT_WRIST": {
          "x": 0.34,
          "y": 0.54,
          "z": -0.05,
          "confidence": 0.9
        },
        "POSE_RIGHT_WRIST": {
          "x": 0.66,
          "y": 0.53,
          "z": -0.05,
          "confidence": 0.92
        }
      }
    }
  ]
}